{
  "$schema": "https://json-schema.org/draft/2020-12/schema",
  "$id": "urn:reasoning-graph:state.schema.json",
  "title": "Reasoning Graph State",
  "type": "object",
  "additionalProperties": true,
  "properties": {
    "summary": {
      "$ref": "#/$defs/summary"
    },
    "nodes": {
      "type": "array",
      "items": {
        "$ref": "#/$defs/node"
      },
      "default": []
    },
    "edges": {
      "type": "array",
      "items": {
        "$ref": "#/$defs/edge"
      },
      "default": []
    },
    "factors": {
      "type": "array",
      "items": {
        "$ref": "#/$defs/factor"
      },
      "default": []
    },
    "events": {
      "type": "array",
      "items": {
        "$ref": "#/$defs/event"
      },
      "default": []
    },
    "goal_policy": {
      "$ref": "#/$defs/goalPolicy"
    },
    "goal_groups": {
      "type": "array",
      "items": {
        "$ref": "#/$defs/goalGroup"
      }
    },
    "stop_policy": {
      "$ref": "#/$defs/stopPolicy"
    },
    "report": {
      "$ref": "#/$defs/report"
    },
    "presentation": {
      "$ref": "#/$defs/presentation"
    },
    "view": {
      "$ref": "#/$defs/view"
    }
  },
  "$defs": {
    "id": {
      "type": "string",
      "minLength": 1
    },
    "probability": {
      "type": "number",
      "exclusiveMinimum": 0,
      "maximum": 1
    },
    "stringList": {
      "type": "array",
      "items": {
        "type": "string",
        "minLength": 1
      }
    },
    "summary": {
      "type": "object",
      "additionalProperties": true,
      "properties": {
        "title": {
          "type": "string"
        },
        "answer": {
          "type": "string"
        }
      }
    },
    "scoreStipulation": {
      "description": "Goals, constraints, and tests are objectives, boundaries, or actions, not claims; they carry no numeric score.",
      "not": {
        "anyOf": [
          {
            "required": [
              "prior"
            ]
          },
          {
            "required": [
              "posterior"
            ]
          }
        ]
      }
    },
    "node": {
      "type": "object",
      "additionalProperties": true,
      "required": [
        "id",
        "type"
      ],
      "properties": {
        "id": {
          "$ref": "#/$defs/id"
        },
        "type": {
          "enum": [
            "goal",
            "observation",
            "constraint",
            "hypothesis",
            "test",
            "candidate_solution"
          ]
        },
        "text": {
          "type": "string"
        },
        "short_text": {
          "type": "string"
        },
        "source": {
          "type": "string"
        },
        "note": {
          "type": "string",
          "description": "The agent's own working memory for this node: caveats, what is left to check, why an inference holds."
        },
        "quote": {
          "type": "string",
          "description": "Verbatim excerpt from the source backing an observation, hedges included, so review can compare the claim with what the source says."
        },
        "prior": {
          "$ref": "#/$defs/probability",
          "description": "Optional local starting-probability factor, including observation or inference reliability. Multiplies inherited premise belief; omit when it would repeat uncertainty already in the premises. Not rewritten by the engine."
        },
        "posterior": {
          "$ref": "#/$defs/probability",
          "description": "Explicit calibrated override for this node's overall belief. Bypasses its prior and incoming premise, factor, and likelihood calculations. Never populated automatically; refresh explicitly when calibration changes."
        },
        "belief": {
          "type": "number",
          "minimum": 0,
          "maximum": 1,
          "description": "Computed belief, written by the CLI on claim nodes so the state can be read as memory. Never authored: record patches reject it and validate fails when it no longer matches the graph."
        },
        "answer_kind": {
          "enum": [
            "exact_answer",
            "exact_method",
            "method_hypothesis",
            "clue_path",
            "blocker"
          ]
        },
        "exhausted": {
          "type": "boolean"
        },
        "exhaustion_reason": {
          "type": "string"
        }
      },
      "allOf": [
        {
          "if": {
            "properties": {
              "type": {
                "enum": [
                  "goal",
                  "constraint",
                  "test"
                ]
              }
            },
            "required": [
              "type"
            ]
          },
          "then": {
            "$ref": "#/$defs/scoreStipulation"
          }
        },
        {
          "if": {
            "properties": {
              "type": {
                "const": "candidate_solution"
              }
            },
            "required": [
              "type"
            ]
          },
          "then": {
            "required": [
              "answer_kind"
            ]
          }
        }
      ],
      "not": {
        "anyOf": [
          {
            "required": [
              "confidence"
            ]
          },
          {
            "required": [
              "probability"
            ]
          }
        ]
      },
      "description": "Claims use prior as their optional local input, computed belief as output, and posterior as an explicit calibrated override. Without prior or posterior, a claim must inherit a belief source through leads_to premises or a calibrated joint-probability factor; the CLI checks the complete graph. A local prior multiplies premise belief, so omit it when it repeats the same uncertainty. Goals, constraints, and tests carry no score. Removed confidence/probability fields are rejected on nodes, not silently ignored or converted. Claims carry the computed belief the CLI writes; it is never authored."
    },
    "likelihood": {
      "type": "object",
      "additionalProperties": false,
      "required": [
        "if_target_true",
        "if_target_false"
      ],
      "properties": {
        "if_target_true": {
          "$ref": "#/$defs/probability"
        },
        "if_target_false": {
          "$ref": "#/$defs/probability"
        }
      }
    },
    "edge": {
      "type": "object",
      "additionalProperties": true,
      "required": [
        "id",
        "from",
        "to",
        "type",
        "reasoning"
      ],
      "properties": {
        "id": {
          "$ref": "#/$defs/id"
        },
        "from": {
          "$ref": "#/$defs/id"
        },
        "to": {
          "$ref": "#/$defs/id"
        },
        "type": {
          "enum": [
            "requires",
            "supports",
            "contradicts",
            "prompts",
            "tested_by",
            "tests",
            "leads_to",
            "answers"
          ]
        },
        "likelihood": {
          "$ref": "#/$defs/likelihood"
        },
        "likelihood_ratio": {
          "type": "number",
          "exclusiveMinimum": 0
        },
        "reasoning": {
          "type": "string",
          "minLength": 1,
          "pattern": "\\S",
          "description": "Explain why this directed relationship holds. Nonblank reasoning is required; one to five sentences is guidance, not a validation limit."
        }
      },
      "not": {
        "anyOf": [
          {
            "required": [
              "likelihood",
              "likelihood_ratio"
            ]
          },
          {
            "required": [
              "label"
            ]
          },
          {
            "required": [
              "hard"
            ]
          },
          {
            "required": [
              "mode"
            ]
          },
          {
            "required": [
              "strength"
            ]
          }
        ]
      }
    },
    "factorAggregation": {
      "type": "object",
      "additionalProperties": true,
      "required": [
        "kind"
      ],
      "properties": {
        "kind": {
          "enum": [
            "joint_probability",
            "likelihood"
          ]
        },
        "probability": {
          "$ref": "#/$defs/probability"
        },
        "if_target_true": {
          "$ref": "#/$defs/probability"
        },
        "if_target_false": {
          "$ref": "#/$defs/probability"
        }
      },
      "allOf": [
        {
          "if": {
            "properties": {
              "kind": {
                "const": "joint_probability"
              }
            },
            "required": [
              "kind"
            ]
          },
          "then": {
            "required": [
              "probability"
            ]
          }
        },
        {
          "if": {
            "properties": {
              "kind": {
                "const": "likelihood"
              }
            },
            "required": [
              "kind"
            ]
          },
          "then": {
            "required": [
              "if_target_true",
              "if_target_false"
            ]
          }
        }
      ],
      "not": {
        "required": [
          "likelihood_ratio"
        ]
      }
    },
    "factor": {
      "type": "object",
      "additionalProperties": true,
      "required": [
        "id",
        "relation",
        "target",
        "inputs",
        "aggregation"
      ],
      "properties": {
        "id": {
          "$ref": "#/$defs/id"
        },
        "relation": {
          "enum": [
            "leads_to",
            "supports",
            "contradicts"
          ]
        },
        "target": {
          "$ref": "#/$defs/id"
        },
        "inputs": {
          "type": "array",
          "minItems": 2,
          "items": {
            "$ref": "#/$defs/id"
          },
          "uniqueItems": true
        },
        "aggregation": {
          "$ref": "#/$defs/factorAggregation"
        },
        "reason": {
          "type": "string"
        }
      },
      "not": {
        "anyOf": [
          {
            "required": [
              "likelihood_ratio"
            ]
          },
          {
            "required": [
              "effective_truth_cost"
            ]
          }
        ]
      }
    },
    "event": {
      "type": "object",
      "additionalProperties": true,
      "required": [
        "step",
        "action"
      ],
      "properties": {
        "step": {
          "type": "integer",
          "minimum": 0
        },
        "action": {
          "enum": [
            "record",
            "review",
            "rank",
            "stop"
          ]
        },
        "best": {
          "$ref": "#/$defs/id"
        },
        "belief": {
          "type": "number",
          "minimum": 0,
          "maximum": 1
        },
        "candidates": {
          "type": "array",
          "items": {
            "type": "object",
            "additionalProperties": true,
            "required": [
              "node",
              "belief",
              "effective_truth_cost"
            ],
            "properties": {
              "node": {
                "$ref": "#/$defs/id"
              },
              "belief": {
                "type": "number",
                "minimum": 0,
                "maximum": 1
              },
              "effective_truth_cost": {
                "type": "number"
              }
            }
          }
        },
        "reason": {
          "type": "string"
        },
        "outcome": {
          "enum": [
            "solved",
            "candidate_threshold_met",
            "candidate_count_met",
            "budget_exhausted",
            "blocked",
            "user_stopped",
            "inconclusive"
          ]
        },
        "add_nodes": {
          "$ref": "#/$defs/stringList"
        },
        "add_edges": {
          "$ref": "#/$defs/stringList"
        },
        "update_factors": {
          "$ref": "#/$defs/stringList"
        },
        "updated_nodes": {
          "type": "array",
          "items": {
            "anyOf": [
              {
                "$ref": "#/$defs/id"
              },
              {
                "type": "object",
                "additionalProperties": true,
                "required": [
                  "id"
                ],
                "properties": {
                  "id": {
                    "$ref": "#/$defs/id"
                  },
                  "fields": {
                    "$ref": "#/$defs/stringList"
                  }
                }
              }
            ]
          }
        }
      },
      "allOf": [
        {
          "if": {
            "properties": {
              "action": {
                "const": "record"
              }
            },
            "required": [
              "action"
            ]
          },
          "then": {
            "required": [
              "reason",
              "add_nodes",
              "add_edges"
            ]
          }
        },
        {
          "if": {
            "properties": {
              "action": {
                "const": "review"
              }
            },
            "required": [
              "action"
            ]
          },
          "then": {
            "required": [
              "reviewer",
              "verdict",
              "findings"
            ]
          }
        },
        {
          "if": {
            "properties": {
              "action": {
                "enum": [
                  "rank"
                ]
              }
            },
            "required": [
              "action"
            ]
          },
          "then": {
            "required": [
              "best",
              "belief",
              "candidates"
            ]
          }
        },
        {
          "if": {
            "properties": {
              "action": {
                "const": "stop"
              }
            },
            "required": [
              "action"
            ]
          },
          "then": {
            "required": [
              "reason",
              "outcome"
            ]
          }
        }
      ],
      "not": {
        "anyOf": [
          {
            "required": [
              "update_premise_groups"
            ]
          },
          {
            "required": [
              "add_premise_groups"
            ]
          },
          {
            "required": [
              "add_factors"
            ]
          },
          {
            "required": [
              "no_reopen_reason"
            ]
          },
          {
            "required": [
              "exhaustion_reason"
            ]
          }
        ]
      }
    },
    "goalPolicy": {
      "type": "object",
      "additionalProperties": true,
      "properties": {
        "accepted_goals": {
          "$ref": "#/$defs/stringList"
        },
        "preferred_goals": {
          "$ref": "#/$defs/stringList"
        }
      }
    },
    "goalGroup": {
      "type": "object",
      "additionalProperties": true,
      "required": [
        "id",
        "goals"
      ],
      "properties": {
        "id": {
          "$ref": "#/$defs/id"
        },
        "goals": {
          "$ref": "#/$defs/stringList"
        },
        "exclusive": {
          "type": "boolean"
        }
      }
    },
    "stopPolicy": {
      "type": "object",
      "additionalProperties": true,
      "properties": {
        "min_viable_candidates": {
          "type": "integer",
          "minimum": 0
        },
        "belief_threshold": {
          "$ref": "#/$defs/probability"
        },
        "require_review": {
          "type": "boolean",
          "description": "Confidence stops need a passing review event recorded after the last record event."
        },
        "severity": {
          "enum": [
            "warning",
            "error"
          ]
        }
      }
    },
    "report": {
      "type": "object",
      "additionalProperties": true,
      "properties": {
        "title": {
          "type": "string"
        },
        "answer": {
          "type": "string"
        },
        "candidates": {
          "type": "array",
          "items": {
            "$ref": "#/$defs/reportCandidate"
          }
        },
        "winning_path": {
          "type": "array",
          "items": {
            "type": "string"
          }
        },
        "next_verification": {
          "type": "string"
        }
      }
    },
    "reportCandidate": {
      "type": "object",
      "additionalProperties": true,
      "properties": {
        "id": {
          "$ref": "#/$defs/id"
        },
        "name": {
          "type": "string"
        },
        "belief": {
          "type": "number",
          "minimum": 0,
          "maximum": 1
        },
        "truth_cost": {
          "type": "number"
        },
        "effective_truth_cost": {
          "type": "number"
        },
        "weight": {
          "type": "number",
          "minimum": 0,
          "maximum": 1
        },
        "path_nodes": {
          "$ref": "#/$defs/stringList"
        },
        "why": {
          "type": "string"
        },
        "next_test": {
          "type": "string"
        }
      }
    },
    "presentation": {
      "type": "object",
      "additionalProperties": true,
      "properties": {
        "include_nodes": {
          "$ref": "#/$defs/stringList"
        },
        "highlight_nodes": {
          "$ref": "#/$defs/stringList"
        },
        "dim_nodes": {
          "$ref": "#/$defs/stringList"
        },
        "title": {
          "type": "string"
        },
        "layout_hint": {
          "type": "string"
        }
      }
    },
    "view": {
      "type": "object",
      "additionalProperties": true,
      "properties": {
        "winning_path": {
          "$ref": "#/$defs/stringList"
        },
        "dimmed_branches": {
          "$ref": "#/$defs/stringList"
        }
      }
    }
  },
  "allOf": [
    {
      "not": {
        "anyOf": [
          {
            "required": [
              "solutions"
            ]
          },
          {
            "required": [
              "premise_groups"
            ]
          },
          {
            "required": [
              "frontier"
            ]
          },
          {
            "required": [
              "search_policy"
            ]
          }
        ]
      }
    }
  ]
}
