{
  "summary": {
    "title": "Strict audit sample",
    "answer": "CS1 (Candidate from A1) wins."
  },
  "nodes": [
    {
      "id": "G1",
      "type": "goal",
      "text": "Pick best cause"
    },
    {
      "id": "O1",
      "type": "observation",
      "text": "Symptom matching the likely cause",
      "source": "user report",
      "prior": 1.0
    },
    {
      "id": "A1",
      "type": "hypothesis",
      "text": "Likely cause",
      "prior": 0.6
    },
    {
      "id": "A2",
      "type": "hypothesis",
      "text": "Less likely cause",
      "prior": 0.4
    },
    {
      "id": "CS1",
      "type": "candidate_solution",
      "text": "Candidate from A1",
      "answer_kind": "exact_answer",
      "prior": 1.0
    }
  ],
  "edges": [
    {
      "id": "E0",
      "from": "O1",
      "to": "A1",
      "type": "leads_to",
      "reasoning": "The observed symptom is the premise for the likely cause."
    },
    {
      "id": "E1",
      "from": "A1",
      "to": "CS1",
      "type": "leads_to",
      "reasoning": "The target conclusion depends on this premise."
    },
    {
      "id": "E2",
      "from": "CS1",
      "to": "G1",
      "type": "answers",
      "reasoning": "This candidate supplies the answer requested by the goal."
    }
  ],
  "events": [
    {
      "step": 1,
      "action": "record",
      "reason": "Worked Q1",
      "add_nodes": [
        "CS1"
      ],
      "add_edges": [
        "E1",
        "E2"
      ],
      "update_factors": []
    },
    {
      "step": 2,
      "action": "rank",
      "best": "CS1",
      "belief": 0.6,
      "candidates": [
        {
          "node": "CS1",
          "belief": 0.6,
          "effective_truth_cost": 0.510826
        }
      ]
    },
    {
      "step": 3,
      "action": "stop",
      "reason": "CS1 answers G1 and its premise chain is recorded",
      "outcome": "solved"
    }
  ]
}
